audio_filepath	duration	text
F:\archive\mp3V2\FPTOpenSpeechData_Set002_V0.1_002539.wav	3.504	ngồi câu cá bên bờ sông gió mát không khí yên tĩnh
F:\archive\mp3V2\FPTOpenSpeechData_Set002_V0.1_008788.wav	4.536	người chết không nói được không thanh minh được nhưng tôi tin là họ vẫn biết
F:\archive\mp3V2\FPTOpenSpeechData_Set001_V0.1_001420.wav	3.67298	tôi muốn một phòng đợi ở gần phi trường thích hơn
F:\archive\mp3V2\FPTOpenSpeechData_Set002_V0.1_010243.wav	4.08	dù tật nguyền không thể đi lại được nhưng phúc rất thích đi học
F:\archive\mp3V2\FPTOpenSpeechData_Set001_V0.1_002841.wav	4.41698	có điểm gì khác biệt giữa chiếc khăn choàng này và chiếc kia không
F:\archive\mp3V2\FPTOpenSpeechData_Set001_V0.1_007428.wav	4.92098	mà hai nước xung đột ở nam á lại nằm kề nhau
F:\archive\mp3V2\FPTOpenSpeechData_Set002_V0.1_011446.wav	4.104	làm ơn cho tôi xem một vài loại rượu mùi
F:\archive\mp3V2\FPTOpenSpeechData_Set001_V0.1_012157.wav	2.06498	ồ điều gì được viết trên tấm biển
F:\archive\mp3V2\FPTOpenSpeechData_Set001_V0.1_012162.wav	1.58498	tắt điều hòa phòng ngủ
F:\archive\mp3V2\FPTOpenSpeechData_Set001_V0.1_004778.wav	4.80098	nó giống cái tôi đã nghĩ cái này quá nhỏ bạn có phiền nếu tôi thử cái khác không
F:\archive\mp3V2\FPTOpenSpeechData_Set002_V0.1_006157.wav	4.464	và tiếp nhận điều trị hàng chục ca nặng có biểu hiện về tâm thần mỗi năm
F:\archive\mp3V2\FPTOpenSpeechData_Set002_V0.1_003945.wav	4.584	tôi thấy một năm qua tôi không mất gì cả mà chỉ có được
F:\archive\mp3V2\FPTOpenSpeechData_Set002_V0.1_011666.wav	2.976	bao nhiêu lâu nữa thì chúng sẽ xong xuôi
F:\archive\mp3V2\FPTOpenSpeechData_Set001_V0.1_006001.wav	1.46498	chỉ đi qua thôi
F:\archive\mp3V2\FPTOpenSpeechData_Set001_V0.1_001858.wav	2.01698	hãy thay áo quần cho bà ấy
F:\archive\mp3V2\FPTOpenSpeechData_Set001_V0.1_007684.wav	2.30498	kìa ai đang nghịch trái tim
F:\archive\mp3V2\FPTOpenSpeechData_Set002_V0.1_010171.wav	4.584	nhiều năm trở lại đây mẹ hồng đổ bệnh nặng thường xuyên phải nhập viện
F:\archive\mp3V2\FPTOpenSpeechData_Set002_V0.1_011614.wav	4.224	riêng cách sống thì có người hướng ngoại muốn mình nổi bật trước đám đông
F:\archive\mp3V2\FPTOpenSpeechData_Set001_V0.1_009913.wav	2.47298	nhà trọ rầy đây mai đó
F:\archive\mp3V2\FPTOpenSpeechData_Set001_V0.1_012360.wav	2.04098	không tôi nghĩ anh sẽ thích nó
F:\archive\mp3V2\FPTOpenSpeechData_Set001_V0.1_012274.wav	1.58498	rượu trắng với nước khoáng
F:\archive\mp3V2\FPTOpenSpeechData_Set001_V0.1_008718.wav	3.04898	anh có thể đưa tôi đến đường cao tốc không
F:\archive\mp3V2\FPTOpenSpeechData_Set002_V0.1_011305.wav	4.824	tôi chưa bao giờ làm thơ hay viết nhạc vẽ lại càng không thể
F:\archive\mp3V2\FPTOpenSpeechData_Set002_V0.1_009571.wav	3.744	nói cách khác nghề diễn đang bị nghiệp dư hóa
F:\archive\mp3V2\FPTOpenSpeechData_Set002_V0.1_000983.wav	4.704	lúc này người chồng sung sức nhất còn người vợ thì thích được vuốt ve
F:\archive\mp3V2\FPTOpenSpeechData_Set001_V0.1_005598.wav	4.05698	con đường dài lắm không có anh em đi làm sao
F:\archive\mp3V2\FPTOpenSpeechData_Set002_V0.1_002856.wav	3.696	và đây là hậu trường có cả các chú trong đoàn phim
F:\archive\mp3V2\FPTOpenSpeechData_Set001_V0.1_011144.wav	2.06498	bạn trả lời cháu rất thích vẽ
F:\archive\mp3V2\FPTOpenSpeechData_Set002_V0.1_010396.wav	4.296	cô quê ở lý nhân hà nam nhà làm ruộng
F:\archive\mp3V2\FPTOpenSpeechData_Set001_V0.1_008904.wav	2.13698	tắt bình nóng lạnh phòng vệ sinh
F:\archive\mp3V2\FPTOpenSpeechData_Set001_V0.1_007240.wav	1.68098	không đi học nữa đâu
F:\archive\mp3V2\FPTOpenSpeechData_Set001_V0.1_002456.wav	4.16883	được sân bay được phủ bởi hệ thống đường ray tàu điện ngầm
F:\archive\mp3V2\FPTOpenSpeechData_Set001_V0.1_002627.wav	2.06498	tôi muốn toa có giường ngủ
F:\archive\mp3V2\FPTOpenSpeechData_Set001_V0.1_007113.wav	1.84898	nó có dừng ở đà nẵng không
F:\archive\mp3V2\FPTOpenSpeechData_Set002_V0.1_006039.wav	4.776	từ khi vào quân ngũ đến giờ tôi luôn là người lính của biên cương
F:\archive\mp3V2\FPTOpenSpeechData_Set002_V0.1_001558.wav	4.944	hôm qua một con số không tưởng vừa được đưa ra
F:\archive\mp3V2\FPTOpenSpeechData_Set001_V0.1_004449.wav	1.72898	xin cho hai ly nước
F:\archive\mp3V2\FPTOpenSpeechData_Set001_V0.1_000143.wav	4.68098	một số trò chơi đòi hỏi các động tác chậm thận trọng hãy từ từ
F:\archive\mp3V2\FPTOpenSpeechData_Set001_V0.1_011137.wav	3.07298	nói một cách đơn giản nông nghiệp cần cuộc cách mạng khác
F:\archive\mp3V2\FPTOpenSpeechData_Set001_V0.1_006588.wav	3.48098	không nhưng nó phù hợp với chế độ ăn của ất kin
F:\archive\mp3V2\FPTOpenSpeechData_Set001_V0.1_000605.wav	2.68898	cài đặt lại phần mềm tốn cả ngày
F:\archive\mp3V2\FPTOpenSpeechData_Set001_V0.1_008680.wav	3.81698	động lực chính của tăng trưởng là nhu cầu nội địa mạnh mẽ
F:\archive\mp3V2\FPTOpenSpeechData_Set002_V0.1_008560.wav	4.44	sau khi một màn hình khác hiện ra bạn có thể tạo tên miền riêng
F:\archive\mp3V2\FPTOpenSpeechData_Set002_V0.1_011517.wav	3.984	họ lo cũng đúng nhưng đâu đến nỗi thế
F:\archive\mp3V2\FPTOpenSpeechData_Set001_V0.1_002857.wav	4.32098	không khí trường đua rất sôi động bởi hàng trăm người hâm mộ đến đây để chứng kiến những cuộc đua tốc độ
F:\archive\mp3V2\FPTOpenSpeechData_Set002_V0.1_008257.wav	4.272	thông qua hệ thống truyền thanh cơ sở các buổi ngoại khóa tổ chức hội nghị
F:\archive\mp3V2\FPTOpenSpeechData_Set001_V0.1_001619.wav	3.31298	phích nước đựng nước sôi để pha trà
F:\archive\mp3V2\FPTOpenSpeechData_Set001_V0.1_014050.wav	1.29698	tôi đi bây giờ
F:\archive\mp3V2\FPTOpenSpeechData_Set001_V0.1_002745.wav	4.89698	tại sao bạn có làn da ngăm đen nhưng người khác lại trắng đẹp đến vậy
F:\archive\mp3V2\FPTOpenSpeechData_Set002_V0.1_008792.wav	3.024	theo ông ý kiến này liệu có thuyết phục
F:\archive\mp3V2\FPTOpenSpeechData_Set002_V0.1_003049.wav	2.112	tôi cần điều trị cho răng của tôi
F:\archive\mp3V2\FPTOpenSpeechData_Set001_V0.1_012438.wav	3.26498	tôi có hai chị em gái một anh em trai
F:\archive\mp3V2\FPTOpenSpeechData_Set001_V0.1_003367.wav	4.50362	do còn lượng nước trong cồn nhiều hơn nên động cơ ít bị nóng hơn
F:\archive\mp3V2\FPTOpenSpeechData_Set001_V0.1_000195.wav	1.63298	cái này trên tầng ba
F:\archive\mp3V2\FPTOpenSpeechData_Set001_V0.1_000851.wav	3.19298	tôi muốn đặt chỗ trước cho hai người vào bảy giờ tối nay
F:\archive\mp3V2\FPTOpenSpeechData_Set002_V0.1_010889.wav	4.224	ung thư thì sao chứ đó là bệnh chung của xã hội bây giờ
F:\archive\mp3V2\FPTOpenSpeechData_Set002_V0.1_010016.wav	3.432	những ngày này hà nội về đêm lung linh rực rỡ hơn
F:\archive\mp3V2\FPTOpenSpeechData_Set002_V0.1_009027.wav	4.656	bảy ngày sau động đất điều kỳ diệu đã xảy ra
F:\archive\mp3V2\FPTOpenSpeechData_Set001_V0.1_010173.wav	2.90498	cú xỉa bóng vào góc hẹp của minh nghĩa
F:\archive\mp3V2\FPTOpenSpeechData_Set001_V0.1_008163.wav	1.29698	anh rất tốt
F:\archive\mp3V2\FPTOpenSpeechData_Set001_V0.1_002160.wav	1.75298	anh có lịch trình không
F:\archive\mp3V2\FPTOpenSpeechData_Set001_V0.1_010140.wav	4.24898	vừa tốn kém lại vừa làm giảm lòng tin của người dân vào nhà nước
F:\archive\mp3V2\FPTOpenSpeechData_Set001_V0.1_011032.wav	2.16098	có mất nhiều thời gian hơn không
F:\archive\mp3V2\FPTOpenSpeechData_Set001_V0.1_005402.wav	2.66498	tôi có phải vẽ ra cho anh không
F:\archive\mp3V2\FPTOpenSpeechData_Set001_V0.1_003911.wav	4.92098	tác động của tình trạng ô nhiễm khí quyển
F:\archive\mp3V2\FPTOpenSpeechData_Set002_V0.1_007629.wav	3.984	tất cả là khoảng một trăm và năm mươi đô la
F:\archive\mp3V2\FPTOpenSpeechData_Set001_V0.1_008085.wav	1.39298	vòi nước bị hư
F:\archive\mp3V2\FPTOpenSpeechData_Set002_V0.1_001667.wav	3.696	nhưng thực sự không phải cô ấy vẫn muốn rong chơi
F:\archive\mp3V2\FPTOpenSpeechData_Set001_V0.1_013691.wav	2.73698	làm sao cô ta lại có câu trả lời điên rồ như vậy nhỉ
F:\archive\mp3V2\FPTOpenSpeechData_Set001_V0.1_008962.wav	3.52898	bạn có thể cho tôi xem những thiết kế khác không
F:\archive\mp3V2\FPTOpenSpeechData_Set001_V0.1_006299.wav	4.65698	anh có chiếc xe tự động hai ngàn cc không
F:\archive\mp3V2\FPTOpenSpeechData_Set002_V0.1_003534.wav	3.984	đến nửa năm rồi nay giá xuống mất một nửa
F:\archive\mp3V2\FPTOpenSpeechData_Set001_V0.1_005534.wav	2.06498	vâng giá sẽ là ba trăm yên
F:\archive\mp3V2\FPTOpenSpeechData_Set001_V0.1_006848.wav	1.70498	tôi sẽ mang cái này lại
F:\archive\mp3V2\FPTOpenSpeechData_Set001_V0.1_012909.wav	2.04098	ti vi giảm âm lượng về ba
F:\archive\mp3V2\FPTOpenSpeechData_Set002_V0.1_008860.wav	3.336	nó không phải mối bận tâm của chúng tôi
F:\archive\mp3V2\FPTOpenSpeechData_Set001_V0.1_012053.wav	4.75298	khi nào chúng ta phải đăng ký cho kỳ học mùa xuân
F:\archive\mp3V2\FPTOpenSpeechData_Set002_V0.1_007626.wav	3.576	có bất kì cái khách sạn nào trên bãi biển không
F:\archive\mp3V2\FPTOpenSpeechData_Set001_V0.1_009258.wav	3.88898	vâng nhưng anh ấy nghĩ chụp hình chung với người lạ thì hơi kỳ
F:\archive\mp3V2\FPTOpenSpeechData_Set001_V0.1_010058.wav	1.65698	diêm của ông ra sao
F:\archive\mp3V2\FPTOpenSpeechData_Set001_V0.1_009139.wav	1.70498	chúng tôi đã có bữa ăn ngon
F:\archive\mp3V2\FPTOpenSpeechData_Set001_V0.1_005679.wav	4.53698	lòng tôi lại dâng lên nỗi niềm nhớ thương da diết
F:\archive\mp3V2\FPTOpenSpeechData_Set001_V0.1_000088.wav	2.78498	chỉ xét tuyển hồ sơ không phải thi
F:\archive\mp3V2\FPTOpenSpeechData_Set001_V0.1_001799.wav	2.40098	để xem những sợi chỉ mong manh kia
F:\archive\mp3V2\FPTOpenSpeechData_Set001_V0.1_002871.wav	2.11298	mong bạn có một ngày dễ chịu
F:\archive\mp3V2\FPTOpenSpeechData_Set002_V0.1_009758.wav	4.464	khách đến nhà chơi bao giờ thống cũng chỉ núp sau cánh cửa
F:\archive\mp3V2\FPTOpenSpeechData_Set002_V0.1_004284.wav	4.44	còn biết rồi thì tránh ra không sợ nữa
F:\archive\mp3V2\FPTOpenSpeechData_Set002_V0.1_011520.wav	3.456	tuy nhiên các đề xuất này không dễ thực hiện
F:\archive\mp3V2\FPTOpenSpeechData_Set001_V0.1_010902.wav	1.60898	ở đây bạn có xì dầu không
F:\archive\mp3V2\FPTOpenSpeechData_Set001_V0.1_002879.wav	2.44898	khi nào thì ta phải ra khỏi đây
F:\archive\mp3V2\FPTOpenSpeechData_Set001_V0.1_012281.wav	1.39298	thức ăn quá ngọt
F:\archive\mp3V2\FPTOpenSpeechData_Set002_V0.1_009926.wav	4.704	hoa thiên lý xào với thịt bò có ướp chút gừng và nước tương cho thấm
F:\archive\mp3V2\FPTOpenSpeechData_Set001_V0.1_010413.wav	2.68898	xin lỗi bạn có thể giúp tôi chọn cỡ không
F:\archive\mp3V2\FPTOpenSpeechData_Set002_V0.1_011529.wav	3.984	chiểu bị khởi tố truy tố về tội trộm cắp tài sản
F:\archive\mp3V2\FPTOpenSpeechData_Set002_V0.1_002507.wav	3.456	bóng đá mở ra tương lai và tương lai phụ thuộc vào bóng đá
F:\archive\mp3V2\FPTOpenSpeechData_Set002_V0.1_009976.wav	4.224	mỗi mùa giải điều quan trọng là phải khởi đầu thật tốt
F:\archive\mp3V2\FPTOpenSpeechData_Set001_V0.1_000564.wav	2.35298	vui lòng mang lại dĩa thức ăn
F:\archive\mp3V2\FPTOpenSpeechData_Set002_V0.1_010912.wav	3.024	mỗi người đồng tính đều có một tâm hồn một tính cách
F:\archive\mp3V2\FPTOpenSpeechData_Set001_V0.1_008984.wav	2.49698	giá đậu xe một tiếng là bao nhiu
F:\archive\mp3V2\FPTOpenSpeechData_Set001_V0.1_013479.wav	1.96898	nó là cái túi nhựa màu nâu
F:\archive\mp3V2\FPTOpenSpeechData_Set001_V0.1_002950.wav	3.36098	về mặt kỷ cương hành chính không thể chấp nhận
F:\archive\mp3V2\FPTOpenSpeechData_Set002_V0.1_005757.wav	3.456	đây là một nghịch lý rất thiếu công bằng hiện nay
F:\archive\mp3V2\FPTOpenSpeechData_Set002_V0.1_011198.wav	4.704	sau này khi quen người khác cô ấy cứ bị giày vò đến tội nghiệp
F:\archive\mp3V2\FPTOpenSpeechData_Set002_V0.1_004874.wav	3.48	vẫn có vài điểm mà tôi không hiểu rõ lắm
F:\archive\mp3V2\FPTOpenSpeechData_Set001_V0.1_010508.wav	3.14498	anh có dư một bản đồ tuyến đường phải không
F:\archive\mp3V2\FPTOpenSpeechData_Set001_V0.1_001961.wav	2.80898	hai mươi tám hai mươi chín
F:\archive\mp3V2\FPTOpenSpeechData_Set001_V0.1_007984.wav	2.44898	anh có chỗ cho một người cắm trại không
F:\archive\mp3V2\FPTOpenSpeechData_Set001_V0.1_012631.wav	1.53698	nó hỏng rồi
F:\archive\mp3V2\FPTOpenSpeechData_Set002_V0.1_006614.wav	4.296	chính vì vậy việc tiếp cận hiện trường vô cùng khó khăn
F:\archive\mp3V2\FPTOpenSpeechData_Set001_V0.1_008815.wav	3.98498	hành vi của ông tiến không đủ yếu tố cấu thành tội nhân hối lộ
F:\archive\mp3V2\FPTOpenSpeechData_Set001_V0.1_000742.wav	3.33698	tỷ phú đức tự tử vì khủng hoảng kinh tế
F:\archive\mp3V2\FPTOpenSpeechData_Set002_V0.1_011076.wav	4.896	xếp cá và cơm nguội vào cái khạp mắm để càng lâu càng ngon
F:\archive\mp3V2\FPTOpenSpeechData_Set001_V0.1_000075.wav	2.16098	tôi có ba con gái
F:\archive\mp3V2\FPTOpenSpeechData_Set001_V0.1_007806.wav	4.17698	như vậy thì nhà nước trả tiền lương cho các vị để làm gì đây
F:\archive\mp3V2\FPTOpenSpeechData_Set001_V0.1_001048.wav	2.20898	ồ tôi nghĩ khoảng hai dãy nhà nữa
F:\archive\mp3V2\FPTOpenSpeechData_Set002_V0.1_010227.wav	4.344	nuôi chim chỉ là thú vui cái chính là việc học
F:\archive\mp3V2\FPTOpenSpeechData_Set002_V0.1_001137.wav	4.824	những ngày tết vừa qua điều gì ấn tượng nhất đối với bạn
F:\archive\mp3V2\FPTOpenSpeechData_Set001_V0.1_001316.wav	4.20098	bị trào ngược bị sứt môi chẻ vòm ăn uống khó khăn
F:\archive\mp3V2\FPTOpenSpeechData_Set001_V0.1_008584.wav	2.61698	cho tôi một chiếc chăn và một chiếc gối được không
F:\archive\mp3V2\FPTOpenSpeechData_Set002_V0.1_006396.wav	3.144	tại trụ sở cảnh sát tính và huy khai toàn bộ hành vi
F:\archive\mp3V2\FPTOpenSpeechData_Set001_V0.1_001989.wav	4.68098	nên rốt cục bộ phải tuyên bố dự án tốt đẹp ấy bị phá sản
F:\archive\mp3V2\FPTOpenSpeechData_Set001_V0.1_007493.wav	4.58498	đây là số tiền của giám đốc và công nhân viên công ty đóng góp
F:\archive\mp3V2\FPTOpenSpeechData_Set001_V0.1_004308.wav	2.40098	tôi không yêu cô ấy nữa
F:\archive\mp3V2\FPTOpenSpeechData_Set001_V0.1_007447.wav	4.87298	trong vụ này người bà đã đồng ý sẽ sinh hộ người mẹ bởi tử cung của mẹ bị cắt bỏ do ung thư
F:\archive\mp3V2\FPTOpenSpeechData_Set001_V0.1_002645.wav	1.92098	nếu nói như vậy là không trung thực
F:\archive\mp3V2\FPTOpenSpeechData_Set002_V0.1_001568.wav	3.936	họ bỏ cả ruộng nương không nghe lời khuyên của cán bộ
F:\archive\mp3V2\FPTOpenSpeechData_Set001_V0.1_011513.wav	3.69238	mất ngủ gây ảnh hưởng không nhỏ đến sức khỏe và tinh thần
F:\archive\mp3V2\FPTOpenSpeechData_Set001_V0.1_006683.wav	1.94498	tôi muốn thuốc trị khó tiêu
F:\archive\mp3V2\FPTOpenSpeechData_Set001_V0.1_001624.wav	3.00098	tháng sau tôi sẽ đi pháp tây ban nha và ý
F:\archive\mp3V2\FPTOpenSpeechData_Set001_V0.1_003102.wav	2.92898	xin lỗi anh có thể lái xe chậm hơn không
F:\archive\mp3V2\FPTOpenSpeechData_Set002_V0.1_001867.wav	2.136	tôi có thể nói chuyện với bạn chứ
F:\archive\mp3V2\FPTOpenSpeechData_Set002_V0.1_009000.wav	4.152	tỉ giá lên sẽ khiến giá nhập nguyên liệu vật tư thiết bị
F:\archive\mp3V2\FPTOpenSpeechData_Set001_V0.1_008307.wav	3.38498	cách chức cho nghỉ việc hàng loạt công chức ngành giáo dục
F:\archive\mp3V2\FPTOpenSpeechData_Set001_V0.1_009730.wav	2.35298	tăng nhiệt độ lên hai mươi lăm độ
F:\archive\mp3V2\FPTOpenSpeechData_Set001_V0.1_006426.wav	1.45973	nếu cho một điều ước anh ước
F:\archive\mp3V2\FPTOpenSpeechData_Set001_V0.1_004154.wav	1.84898	không anh không được
F:\archive\mp3V2\FPTOpenSpeechData_Set002_V0.1_010149.wav	3.6	làm tốt công tác phòng chống dịch bệnh
F:\archive\mp3V2\FPTOpenSpeechData_Set001_V0.1_010455.wav	2.61698	bật ti vi
F:\archive\mp3V2\FPTOpenSpeechData_Set001_V0.1_011328.wav	2.40098	tôi ngắt lời một chút được không
F:\archive\mp3V2\FPTOpenSpeechData_Set001_V0.1_009358.wav	3.84098	hầu hết du khách nhật bản không thấy một thứ như thế này
F:\archive\mp3V2\FPTOpenSpeechData_Set001_V0.1_013664.wav	2.04098	có nhiều tiết mục mới và hấp dẫn
F:\archive\mp3V2\FPTOpenSpeechData_Set001_V0.1_012017.wav	1.72898	bạn sống với ai
F:\archive\mp3V2\FPTOpenSpeechData_Set001_V0.1_000422.wav	2.66498	xin lỗi ông cho tôi lấy hóa đơn được không
F:\archive\mp3V2\FPTOpenSpeechData_Set001_V0.1_006563.wav	3.14498	khán đài và sân khấu hoành tráng
F:\archive\mp3V2\FPTOpenSpeechData_Set001_V0.1_005594.wav	1.24898	anh muốn màu gì
F:\archive\mp3V2\FPTOpenSpeechData_Set002_V0.1_001020.wav	3.624	nỗi lo về an ninh gian lận là có thật
F:\archive\mp3V2\FPTOpenSpeechData_Set001_V0.1_002909.wav	4.41698	bệnh này có ảnh hưởng tới các hoạt động hằng ngày của quí vị không
F:\archive\mp3V2\FPTOpenSpeechData_Set001_V0.1_002013.wav	3.84098	ngày nay đàn ông nào mà chẳng giống nhau
F:\archive\mp3V2\FPTOpenSpeechData_Set001_V0.1_000713.wav	2.01698	có siêu thị ở góc đường này
F:\archive\mp3V2\FPTOpenSpeechData_Set001_V0.1_003468.wav	1.70498	cảm ơn anh rất nhiều vì đã đến đây
F:\archive\mp3V2\FPTOpenSpeechData_Set002_V0.1_002520.wav	3.408	khi hải diễn vai lam hải làm cho tôi rất ngạc nhiên
F:\archive\mp3V2\FPTOpenSpeechData_Set002_V0.1_009636.wav	4.704	nhưng quá khứ hiện tại anh không thể làm được điều đó
F:\archive\mp3V2\FPTOpenSpeechData_Set001_V0.1_002151.wav	1.58498	tôi bị đau bụng dai dẳng
F:\archive\mp3V2\FPTOpenSpeechData_Set001_V0.1_003499.wav	2.37698	cảnh sát hình sự tiếp tục phát sóng
F:\archive\mp3V2\FPTOpenSpeechData_Set001_V0.1_012546.wav	1.68098	anh ấy không thể nhận tin nhắn
F:\archive\mp3V2\FPTOpenSpeechData_Set002_V0.1_010854.wav	2.496	bạn nên được nhập viện và được phẫu thuật
F:\archive\mp3V2\FPTOpenSpeechData_Set001_V0.1_004098.wav	4.00898	cây cỏ xum xuê tiếng nhạc trịnh hòa tấu du dương
F:\archive\mp3V2\FPTOpenSpeechData_Set002_V0.1_000691.wav	4.08	trung quốc phần lan đức hay một quốc gia nào khác
F:\archive\mp3V2\FPTOpenSpeechData_Set001_V0.1_005089.wav	2.13698	cô ấy đã đặt trước tạm thời
F:\archive\mp3V2\FPTOpenSpeechData_Set001_V0.1_011581.wav	3.33698	bạn có thể cho tôi biết nó bao nhiêu tiền không
F:\archive\mp3V2\FPTOpenSpeechData_Set002_V0.1_011555.wav	3.456	và trong tình thế đó tôi không thể cắt ngang lời anh ấy
F:\archive\mp3V2\FPTOpenSpeechData_Set001_V0.1_007460.wav	1.34498	nó mới lạnh làm sao
F:\archive\mp3V2\FPTOpenSpeechData_Set001_V0.1_009023.wav	2.11298	có vết đứt không
F:\archive\mp3V2\FPTOpenSpeechData_Set001_V0.1_009061.wav	2.42498	một của hiệp hội sản xuất bia
F:\archive\mp3V2\FPTOpenSpeechData_Set002_V0.1_006523.wav	3.864	anh có thực sự thấy thỏa mãn với nó không
F:\archive\mp3V2\FPTOpenSpeechData_Set002_V0.1_008904.wav	3.552	đến nay tình trạng sức khỏe của em đã ổn định
F:\archive\mp3V2\FPTOpenSpeechData_Set002_V0.1_004865.wav	4.224	nhưng do thiếu trách nhiệm họ không kiểm tra xem xét thận trọng
F:\archive\mp3V2\FPTOpenSpeechData_Set001_V0.1_011601.wav	2.61698	tôi muốn có đồ thay thế
F:\archive\mp3V2\FPTOpenSpeechData_Set001_V0.1_003067.wav	3.72098	khi nhìn thấy điểm số lịch sử thấp lè tè của học sinh
F:\archive\mp3V2\FPTOpenSpeechData_Set001_V0.1_009454.wav	3.16898	làm thế nào để đến phòng đợi dành cho chuyến bay quốc tế
F:\archive\mp3V2\FPTOpenSpeechData_Set001_V0.1_000214.wav	1.36898	tôi không thể hiểu bạn
F:\archive\mp3V2\FPTOpenSpeechData_Set001_V0.1_013631.wav	3.33698	anh thì không cho đến ngày anh gặp em
F:\archive\mp3V2\FPTOpenSpeechData_Set001_V0.1_003588.wav	3.26498	rồi nóng dần lên như một lò nung vào giữa trưa
F:\archive\mp3V2\FPTOpenSpeechData_Set001_V0.1_007042.wav	2.49698	tờ báo của tôi đã đến trễ
F:\archive\mp3V2\FPTOpenSpeechData_Set002_V0.1_006651.wav	4.224	nên nhớ các thức ăn như thịt cá sữa
F:\archive\mp3V2\FPTOpenSpeechData_Set001_V0.1_010652.wav	3.81698	chị quăng vào mặt tôi một câu rồi ngúng nguẩy bước ra khỏi quán
F:\archive\mp3V2\FPTOpenSpeechData_Set002_V0.1_000733.wav	4.248	không muốn nghĩa là không muốn không có nghĩa là không có
F:\archive\mp3V2\FPTOpenSpeechData_Set001_V0.1_005550.wav	1.53698	bật đèn phòng ăn
F:\archive\mp3V2\FPTOpenSpeechData_Set001_V0.1_001670.wav	3.55298	không tôi đang cân nhắc tới việc thay đổi công việc
F:\archive\mp3V2\FPTOpenSpeechData_Set002_V0.1_003075.wav	3.456	sau cuộc thi tiếng anh của bạn sẽ tiến bộ đáng kể
F:\archive\mp3V2\FPTOpenSpeechData_Set002_V0.1_010150.wav	4.656	lâu dài my sẽ theo dòng nhạc cổ điển có chiều sâu
F:\archive\mp3V2\FPTOpenSpeechData_Set002_V0.1_007940.wav	4.248	nhưng chẳng lẽ đi phát thiếp mời cùng trong công ty lại người có người không
F:\archive\mp3V2\FPTOpenSpeechData_Set001_V0.1_013519.wav	1.81108	chỉ trễ bốn phút
F:\archive\mp3V2\FPTOpenSpeechData_Set002_V0.1_011010.wav	4.464	nếu có biết em tin gia đình sẽ ủng hộ thôi
F:\archive\mp3V2\FPTOpenSpeechData_Set001_V0.1_009595.wav	2.56898	rẽ phải tại góc phố của đại lộ thứ năm
F:\archive\mp3V2\FPTOpenSpeechData_Set002_V0.1_008844.wav	4.848	xin chào trung tâm quốc tế xin nghe bạn muốn nối máy tới số nào
F:\archive\mp3V2\FPTOpenSpeechData_Set001_V0.1_006133.wav	2.35298	nguyên viện trưởng viện nghiên cứu tôn giáo
F:\archive\mp3V2\FPTOpenSpeechData_Set001_V0.1_012894.wav	3.26498	tôi có thể tìm xe buýt số hai mươi mốt ở đâu
F:\archive\mp3V2\FPTOpenSpeechData_Set002_V0.1_010341.wav	4.68	chợt nghĩ tôi mà vác như thế thì có nước
F:\archive\mp3V2\FPTOpenSpeechData_Set001_V0.1_000534.wav	2.37698	còn đây là thế giới của giày dép
F:\archive\mp3V2\FPTOpenSpeechData_Set001_V0.1_001925.wav	3.09698	kèm theo là tiếng rên đau nhức vọng ra
F:\archive\mp3V2\FPTOpenSpeechData_Set002_V0.1_009633.wav	4.464	đến sáng nay thị trường đang giao dịch không rõ xu hướng
F:\archive\mp3V2\FPTOpenSpeechData_Set002_V0.1_000708.wav	4.056	do đó thí sinh việt nam tiếp tục được tin tưởng
F:\archive\mp3V2\FPTOpenSpeechData_Set001_V0.1_005507.wav	1.70498	mất bao lâu để đi đến
F:\archive\mp3V2\FPTOpenSpeechData_Set001_V0.1_003245.wav	2.80898	chào tôi muốn đổi tiền này
F:\archive\mp3V2\FPTOpenSpeechData_Set002_V0.1_010285.wav	3.48	không đồng ý công nhân xô xát với tôi
F:\archive\mp3V2\FPTOpenSpeechData_Set001_V0.1_000517.wav	2.42498	tôi cho rằng không có vấn đề gì
F:\archive\mp3V2\FPTOpenSpeechData_Set002_V0.1_003096.wav	4.8	đây thực sự là loài côn trùng kỳ ảo chúng thoắt ẩn hiện trong những tán cây rừng
F:\archive\mp3V2\FPTOpenSpeechData_Set001_V0.1_003192.wav	2.13698	dán sau chái bếp
F:\archive\mp3V2\FPTOpenSpeechData_Set001_V0.1_002350.wav	3.28898	để tôi cân cái đó bạn có thể đặt nó lên bàn cân không
F:\archive\mp3V2\FPTOpenSpeechData_Set001_V0.1_006552.wav	4.08098	chúng tôi sẽ gửi hành lý đến khách sạn của bạn
F:\archive\mp3V2\FPTOpenSpeechData_Set002_V0.1_005972.wav	4.296	bạn biết đấy ở các của hàng cà phê của nhật luôn phù hợp
F:\archive\mp3V2\FPTOpenSpeechData_Set001_V0.1_009887.wav	4.10498	tôi nghĩ rằng quần áo rất gợi cảm
F:\archive\mp3V2\FPTOpenSpeechData_Set001_V0.1_007158.wav	3.40898	nó đã tìm quên nỗi cô đơn của mình
F:\archive\mp3V2\FPTOpenSpeechData_Set001_V0.1_010199.wav	3.12098	hãy cho thôi xem vài chiếc áo len dài tay cỡ
F:\archive\mp3V2\FPTOpenSpeechData_Set002_V0.1_003546.wav	3.6	bạn có mang giấy tờ tùy thân dán ảnh không
F:\archive\mp3V2\FPTOpenSpeechData_Set001_V0.1_000999.wav	2.49698	thủ tục lên máy bay vào lúc hai giờ ba mươi
F:\archive\mp3V2\FPTOpenSpeechData_Set002_V0.1_006775.wav	4.176	cùng lúc đó anh cần một số vốn làm ăn riêng
F:\archive\mp3V2\FPTOpenSpeechData_Set001_V0.1_010681.wav	3.07298	thống nhất đầu mối quản lý nhà nước về giáo dục
F:\archive\mp3V2\FPTOpenSpeechData_Set001_V0.1_013544.wav	3.64898	phần ba âm nhạc mê lòng người
