audio_filepath	duration	text
F:\archive\mp3V2\FPTOpenSpeechData_Set002_V0.1_005605.wav	3.744	tuy nhiên điều này đòi hỏi một quá trình học tập
F:\archive\mp3V2\FPTOpenSpeechData_Set001_V0.1_006600.wav	1.24898	tôi muốn đổi tiền
F:\archive\mp3V2\FPTOpenSpeechData_Set001_V0.1_003808.wav	2.68898	nhạc sĩ và lực sĩ em chọn ai
F:\archive\mp3V2\FPTOpenSpeechData_Set001_V0.1_014108.wav	1.82498	văn phòng đóng cửa lúc nào
F:\archive\mp3V2\FPTOpenSpeechData_Set001_V0.1_007255.wav	4.80098	vẫn còn nhiều người đi bộ không tuân theo quy tắc giao thông
F:\archive\mp3V2\FPTOpenSpeechData_Set001_V0.1_010810.wav	2.59298	nâng ly mừng một sự hợp tác thắng lợi
F:\archive\mp3V2\FPTOpenSpeechData_Set001_V0.1_003472.wav	2.06498	tôi muốn đem hành lý này lên toa
F:\archive\mp3V2\FPTOpenSpeechData_Set002_V0.1_004236.wav	4.512	không thể tưởng tượng được mọi thứ như một giấc mơ
F:\archive\mp3V2\FPTOpenSpeechData_Set001_V0.1_011165.wav	2.13698	nhưng ở đó không có chỗ ẩn nấp
F:\archive\mp3V2\FPTOpenSpeechData_Set001_V0.1_008477.wav	4.15298	thỉnh thoảng một cơn đau lạ giáng xuống người tôi
F:\archive\mp3V2\FPTOpenSpeechData_Set002_V0.1_011285.wav	3.744	tai nạn xảy ra khiến bà bị gãy tay chấn thương cột sống cổ
F:\archive\mp3V2\FPTOpenSpeechData_Set001_V0.1_008905.wav	1.60898	tại sao quí vị dừng lại
F:\archive\mp3V2\FPTOpenSpeechData_Set001_V0.1_012211.wav	3.33698	sản xuất điện từ sóng biển
F:\archive\mp3V2\FPTOpenSpeechData_Set002_V0.1_009018.wav	3.264	có chứ ai cũng muốn thế tôi cũng vậy
F:\archive\mp3V2\FPTOpenSpeechData_Set001_V0.1_012885.wav	1.17698	cô ấy muốn chụp hình
F:\archive\mp3V2\FPTOpenSpeechData_Set002_V0.1_005172.wav	3.864	ngay sau đó nạn nhân được đưa đi cấp cứu
F:\archive\mp3V2\FPTOpenSpeechData_Set002_V0.1_004105.wav	4.896	cũng có đạo diễn mời đóng phim nhưng luân vẫn chưa hứng thú
F:\archive\mp3V2\FPTOpenSpeechData_Set001_V0.1_000131.wav	2.49698	anh lắng nghe tôi một phút được không
F:\archive\mp3V2\FPTOpenSpeechData_Set001_V0.1_011591.wav	1.51298	cảm giác nằng nặng
F:\archive\mp3V2\FPTOpenSpeechData_Set001_V0.1_000785.wav	2.61698	nếu bạn không bắt đầu chuẩn bị tôi không cần nữa
F:\archive\mp3V2\FPTOpenSpeechData_Set001_V0.1_008310.wav	1.94498	vui lòng thử lần nữa
F:\archive\mp3V2\FPTOpenSpeechData_Set001_V0.1_009920.wav	2.28098	vui lòng cho đô la siêu xăng không chì
F:\archive\mp3V2\FPTOpenSpeechData_Set002_V0.1_001063.wav	4.824	không nó không xa lắm nó trong khoảng cách đi bộ được
F:\archive\mp3V2\FPTOpenSpeechData_Set001_V0.1_011511.wav	2.61698	tại sao chúng ta không tìm vé mua cho tháng sau
F:\archive\mp3V2\FPTOpenSpeechData_Set002_V0.1_011011.wav	4.944	càng đến ngày con vượt vũ môn chị tuyết càng lo lắng
F:\archive\mp3V2\FPTOpenSpeechData_Set002_V0.1_006188.wav	3.936	sau khi sự việc xảy ra chúng tôi có mặt để tìm hiểu sự việc
F:\archive\mp3V2\FPTOpenSpeechData_Set001_V0.1_014029.wav	3.74498	anh có phiền nếu tôi sử dụng điện thoại một cuộc gọi nội hạt không
F:\archive\mp3V2\FPTOpenSpeechData_Set001_V0.1_002823.wav	1.51298	cô ấy bị mẻ răng
F:\archive\mp3V2\FPTOpenSpeechData_Set001_V0.1_010589.wav	3.24098	phải kiên quyết đấu tranh chống sử dụng vũ khí hóa học
F:\archive\mp3V2\FPTOpenSpeechData_Set001_V0.1_000427.wav	4.46498	không lẽ ước nguyện đó của tôi lại khó đến thế sao
F:\archive\mp3V2\FPTOpenSpeechData_Set001_V0.1_001450.wav	1.84898	chúng ta có nhiều tuyết vào năm nay
F:\archive\mp3V2\FPTOpenSpeechData_Set001_V0.1_005601.wav	4.77698	một tổ kiểm lâm đón chúng tôi trên chiếc bè neo trong khu núi
F:\archive\mp3V2\FPTOpenSpeechData_Set002_V0.1_011294.wav	3.264	vui lòng mang cho tôi một chút nước súp nhé
F:\archive\mp3V2\FPTOpenSpeechData_Set001_V0.1_001800.wav	2.32898	anh ta không thể khóa cửa lại được
F:\archive\mp3V2\FPTOpenSpeechData_Set001_V0.1_008878.wav	3.14498	tất cả chúng tôi đi ăn sáng theo ý mình được không
F:\archive\mp3V2\FPTOpenSpeechData_Set001_V0.1_011254.wav	1.89698	quay trái
F:\archive\mp3V2\FPTOpenSpeechData_Set001_V0.1_012589.wav	4.75298	bạn có thể đặt va li của mình trên quầy và mở nó ra không
F:\archive\mp3V2\FPTOpenSpeechData_Set001_V0.1_010291.wav	2.59298	anh đã chi trội số tiền là
F:\archive\mp3V2\FPTOpenSpeechData_Set002_V0.1_000031.wav	4.584	phú thọ đang thu dọn gạch vỡ xung quanh lò sấy thì bất ngờ mái vòm đổ sập
F:\archive\mp3V2\FPTOpenSpeechData_Set002_V0.1_001792.wav	3.096	làm ơn tôi muốn gội đầu và tạo mẫu tóc
F:\archive\mp3V2\FPTOpenSpeechData_Set002_V0.1_001838.wav	4.104	sau khi mua được súng hiếu thường mang theo để phòng thân
F:\archive\mp3V2\FPTOpenSpeechData_Set001_V0.1_013322.wav	3.69698	lần giao hàng của anh ngày hai mươi tháng mười hai năm hai ngàn lẻ hai
F:\archive\mp3V2\FPTOpenSpeechData_Set002_V0.1_009996.wav	4.848	với chủ trương này của trung quốc việc pháo lậu vào nước ta là khó tránh
F:\archive\mp3V2\FPTOpenSpeechData_Set001_V0.1_002946.wav	1.46498	tôi muốn mở một tài khoản
F:\archive\mp3V2\FPTOpenSpeechData_Set001_V0.1_010198.wav	1.87298	chế tạo thành công
F:\archive\mp3V2\FPTOpenSpeechData_Set001_V0.1_003980.wav	1.48898	món này rất nhiều phải không
F:\archive\mp3V2\FPTOpenSpeechData_Set001_V0.1_003274.wav	3.81698	được bốn bữa sau thì dây dưa phát thấy rõ
F:\archive\mp3V2\FPTOpenSpeechData_Set001_V0.1_003880.wav	1.99298	anh đã đi máy bay bao nhiêu lần rồi
F:\archive\mp3V2\FPTOpenSpeechData_Set001_V0.1_002481.wav	4.12898	số là ba bốn năm sáu bảy tám chín không một hai
F:\archive\mp3V2\FPTOpenSpeechData_Set002_V0.1_005957.wav	3.696	chúng tôi có thể phát bóng lúc chín giờ không
F:\archive\mp3V2\FPTOpenSpeechData_Set002_V0.1_003802.wav	4.176	có người thì nhớ tôi đóng phim này có người lại nhớ tôi đóng phim kia
F:\archive\mp3V2\FPTOpenSpeechData_Set001_V0.1_012206.wav	2.42498	tết âm lịch là vào tháng hai à
F:\archive\mp3V2\FPTOpenSpeechData_Set001_V0.1_006484.wav	2.73698	các địa điểm cắm trại gần nhất ở đâu
F:\archive\mp3V2\FPTOpenSpeechData_Set002_V0.1_011638.wav	3.624	phải nói văn hóa giao thông của chúng ta quá kém
F:\archive\mp3V2\FPTOpenSpeechData_Set002_V0.1_011203.wav	3.504	chẳng quanh co chối tội gì tài khai báo toàn bộ hành vi phạm tội
F:\archive\mp3V2\FPTOpenSpeechData_Set002_V0.1_001865.wav	4.296	phúc chết trong tình trạng lõa thể trên người bị nhiều vết chém sâu
F:\archive\mp3V2\FPTOpenSpeechData_Set001_V0.1_002930.wav	1.22498	tôi sẽ chơi
F:\archive\mp3V2\FPTOpenSpeechData_Set001_V0.1_005645.wav	3.40898	những thực khách vừa gọi bia vừa ợ chua ằng ặc
F:\archive\mp3V2\FPTOpenSpeechData_Set001_V0.1_008316.wav	2.32898	tôi muốn tìm một chiếc áo khoác có cổ hẹp
F:\archive\mp3V2\FPTOpenSpeechData_Set001_V0.1_004437.wav	2.73698	tôi nghĩ chúng ta đang nói mà không hiểu nhau
F:\archive\mp3V2\FPTOpenSpeechData_Set002_V0.1_002803.wav	3.504	tôi có thể được phát hành lại vé máy bay không
F:\archive\mp3V2\FPTOpenSpeechData_Set001_V0.1_003729.wav	2.28098	còn bảo hiểm du lịch thì sao
F:\archive\mp3V2\FPTOpenSpeechData_Set001_V0.1_005437.wav	3.67298	thật là vui nhưng đôi giày đang làm khổ mình
F:\archive\mp3V2\FPTOpenSpeechData_Set001_V0.1_011551.wav	1.92098	cô ấy anh ấy thích trẻ con
F:\archive\mp3V2\FPTOpenSpeechData_Set001_V0.1_010535.wav	2.25698	cách thức trả xe như thế nào
F:\archive\mp3V2\FPTOpenSpeechData_Set002_V0.1_011380.wav	3.696	cái thị xã cao bằng quá nhỏ bé mọi người đều biết nhau cả
F:\archive\mp3V2\FPTOpenSpeechData_Set002_V0.1_002733.wav	2.976	là do người ta chỉ có hưởng thụ không phải lo toan gì hết
F:\archive\mp3V2\FPTOpenSpeechData_Set002_V0.1_010943.wav	3.864	năm người không quen biết đến công sở bước vào thang máy
F:\archive\mp3V2\FPTOpenSpeechData_Set001_V0.1_005917.wav	1.65698	nó là của anh
F:\archive\mp3V2\FPTOpenSpeechData_Set001_V0.1_000215.wav	3.38498	tôi cảm thấy rất nặng nề tôi không thể di chuyển chân của tôi
F:\archive\mp3V2\FPTOpenSpeechData_Set001_V0.1_002026.wav	3.07298	sẽ an toàn nếu bạn sẽ không đi đến khu vực đổ nát
F:\archive\mp3V2\FPTOpenSpeechData_Set002_V0.1_010274.wav	4.2	khi yên ổn họ bảo thế mà vẫn làm thơ được nhỉ
F:\archive\mp3V2\FPTOpenSpeechData_Set001_V0.1_003307.wav	2.20898	khi nào tôi phải đăng ký lên máy bay
F:\archive\mp3V2\FPTOpenSpeechData_Set001_V0.1_001559.wav	1.84898	không tôi dậy lúc năm giờ
F:\archive\mp3V2\FPTOpenSpeechData_Set002_V0.1_010771.wav	4.224	sau khi nhập vào mật khẩu của bạn đường hầm sẽ được tạo
F:\archive\mp3V2\FPTOpenSpeechData_Set001_V0.1_011489.wav	4.70498	kèm theo đơn phải có những giấy tờ sau
F:\archive\mp3V2\FPTOpenSpeechData_Set001_V0.1_010207.wav	2.19851	vận hành máy đập lúa an
F:\archive\mp3V2\FPTOpenSpeechData_Set002_V0.1_009916.wav	4.8	điều đó đúng nhưng đang rất thiếu thực tế
F:\archive\mp3V2\FPTOpenSpeechData_Set001_V0.1_006077.wav	1.93529	anh có thể đến đây để sửa không
F:\archive\mp3V2\FPTOpenSpeechData_Set001_V0.1_001083.wav	3.00098	xin lỗi gần đây có tiệm áo quần nào không
F:\archive\mp3V2\FPTOpenSpeechData_Set001_V0.1_003937.wav	2.73698	có xe buýt đến trung tâm thành phố không
F:\archive\mp3V2\FPTOpenSpeechData_Set002_V0.1_010361.wav	4.008	tất nhiên tôi không bao giờ đồng ý với việc đó
F:\archive\mp3V2\FPTOpenSpeechData_Set001_V0.1_009965.wav	1.87298	chuyện gì đến thì cũng đến
F:\archive\mp3V2\FPTOpenSpeechData_Set002_V0.1_002770.wav	3.48	anh khánh bị ngã thương tích còn xe máy bị chúng cướp mất
F:\archive\mp3V2\FPTOpenSpeechData_Set001_V0.1_012890.wav	2.49698	anh có thích tôi giữ trước quyển sách này cho anh không
F:\archive\mp3V2\FPTOpenSpeechData_Set002_V0.1_011107.wav	3.696	tuy nhiên giá bán nhìn chung không đổi trong quý này
F:\archive\mp3V2\FPTOpenSpeechData_Set001_V0.1_010799.wav	4.03298	các em học sinh thường không la cà lêu lổng sau giờ học
F:\archive\mp3V2\FPTOpenSpeechData_Set001_V0.1_007317.wav	4.94498	chúng có thể buông tay rơi tòm xuống nước chết chìm
F:\archive\mp3V2\FPTOpenSpeechData_Set001_V0.1_002222.wav	4.60898	tính chất quyết liệt của trận cầu này còn đong đầy hơn
F:\archive\mp3V2\FPTOpenSpeechData_Set001_V0.1_006118.wav	2.37698	tôi hoàn thành nó trong hai ngày
F:\archive\mp3V2\FPTOpenSpeechData_Set001_V0.1_004590.wav	1.22498	anh cần đi đâu
F:\archive\mp3V2\FPTOpenSpeechData_Set001_V0.1_013855.wav	1.22498	cái này quá mạnh
F:\archive\mp3V2\FPTOpenSpeechData_Set001_V0.1_001344.wav	1.29698	trong một tuần
F:\archive\mp3V2\FPTOpenSpeechData_Set002_V0.1_001030.wav	3.384	anh tuấn có một em gái nhỏ rất thân với thùy lâm
F:\archive\mp3V2\FPTOpenSpeechData_Set001_V0.1_001802.wav	2.18498	một tuần kể từ bây giờ thưa bà
F:\archive\mp3V2\FPTOpenSpeechData_Set001_V0.1_001502.wav	3.74498	phải như nhau tôi muốn gửi chúng bằng máy bay
F:\archive\mp3V2\FPTOpenSpeechData_Set002_V0.1_007661.wav	3.936	tôi rất ham tiền bây giờ cũng như vậy
F:\archive\mp3V2\FPTOpenSpeechData_Set001_V0.1_002684.wav	2.40098	tôi sẽ chỉ thanh toán một loại
F:\archive\mp3V2\FPTOpenSpeechData_Set002_V0.1_004039.wav	3.864	xin hỏi bị lác chụm có khó chữa không thưa bác sĩ
F:\archive\mp3V2\FPTOpenSpeechData_Set002_V0.1_007771.wav	4.608	về độ bền và tiết kiệm nhiên liệu thì camry phải nói là vô địch
F:\archive\mp3V2\FPTOpenSpeechData_Set001_V0.1_008879.wav	1.05698	nam giới
F:\archive\mp3V2\FPTOpenSpeechData_Set002_V0.1_002714.wav	3.408	với sự cho phép này nhiều trường sẽ tiếp tục công bố xét tuyển
F:\archive\mp3V2\FPTOpenSpeechData_Set002_V0.1_009647.wav	4.176	như vậy bạn sẽ cần phải lo lắng nữa nhé
F:\archive\mp3V2\FPTOpenSpeechData_Set001_V0.1_008913.wav	2.71298	hầu hết chứng khoán đều tăng giá kịch trần
F:\archive\mp3V2\FPTOpenSpeechData_Set001_V0.1_008231.wav	3.76898	người việt chờ mong ngày về
F:\archive\mp3V2\FPTOpenSpeechData_Set001_V0.1_007173.wav	2.54498	anh ta đúng là một người rất hấp dẫn
F:\archive\mp3V2\FPTOpenSpeechData_Set001_V0.1_004881.wav	2.88098	tôi đến đây hai hoặc ba lần một tuần
F:\archive\mp3V2\FPTOpenSpeechData_Set002_V0.1_000970.wav	4.584	vật phẩm dành cho tổ chức sinh nhật ở đâu
F:\archive\mp3V2\FPTOpenSpeechData_Set002_V0.1_004724.wav	4.752	còn bây giờ những đội khách ngày càng mạnh mẽ hơn
F:\archive\mp3V2\FPTOpenSpeechData_Set001_V0.1_002808.wav	2.85698	thanh niên nảy sinh tâm lý ỷ lại
F:\archive\mp3V2\FPTOpenSpeechData_Set001_V0.1_012040.wav	1.80098	khi nào họ làm xong
F:\archive\mp3V2\FPTOpenSpeechData_Set002_V0.1_010846.wav	2.904	mười năm qua tôi đã đợi đến ngày này
F:\archive\mp3V2\FPTOpenSpeechData_Set001_V0.1_007835.wav	3.24098	tốt tôi có thể biết tên bạn được không
F:\archive\mp3V2\FPTOpenSpeechData_Set001_V0.1_002117.wav	3.31298	vâng bạn cũng muốn đọc tạp chí tiếng nhật chứ
F:\archive\mp3V2\FPTOpenSpeechData_Set001_V0.1_011305.wav	3.76898	một số trò chơi đòi hỏi các động tác chậm thận trọng hãy từ từ
F:\archive\mp3V2\FPTOpenSpeechData_Set001_V0.1_000945.wav	2.13698	đừng bao giờ tự mình đi vào rừng
F:\archive\mp3V2\FPTOpenSpeechData_Set002_V0.1_010322.wav	4.464	ở nhiều khu vực tại ngay thủ đô cả điện và nước đều bị cắt
F:\archive\mp3V2\FPTOpenSpeechData_Set001_V0.1_009733.wav	4.03298	gạch lót bị tróc từng mảng kéo dài suốt con đường
F:\archive\mp3V2\FPTOpenSpeechData_Set002_V0.1_011423.wav	3.456	là con gái út my lan được nuông chiều từ nhỏ
F:\archive\mp3V2\FPTOpenSpeechData_Set001_V0.1_012417.wav	1.94498	làm ơn bán món đồ cho tôi
F:\archive\mp3V2\FPTOpenSpeechData_Set001_V0.1_004521.wav	3.09698	hàng trăm công nhân khóc đứng
F:\archive\mp3V2\FPTOpenSpeechData_Set001_V0.1_010441.wav	2.97698	tôi có thể đổi chiếc vòng không
F:\archive\mp3V2\FPTOpenSpeechData_Set001_V0.1_000736.wav	3.12098	thời gian từ đầu đến cuối là bao lâu
F:\archive\mp3V2\FPTOpenSpeechData_Set001_V0.1_009271.wav	2.83298	mỗi lần anh không đọc được một chữ nào đó
F:\archive\mp3V2\FPTOpenSpeechData_Set001_V0.1_012409.wav	3.60098	xe ô tô của tôi hư rồi vui lòng đến và kiểm tra nó
F:\archive\mp3V2\FPTOpenSpeechData_Set002_V0.1_011023.wav	4.224	đồng thời ra lệnh bắt khám xét nơi ở của chinh
F:\archive\mp3V2\FPTOpenSpeechData_Set001_V0.1_003372.wav	3.24098	bạn đã học rất nhiều tối hôm qua
F:\archive\mp3V2\FPTOpenSpeechData_Set001_V0.1_004068.wav	4.05698	hiện chưa rõ hình phạt nào cho những tài xế vô tình ngáp vặt hoặc lén lút ăn vặt
F:\archive\mp3V2\FPTOpenSpeechData_Set001_V0.1_006804.wav	1.51298	bạn đã đặt trước chưa
F:\archive\mp3V2\FPTOpenSpeechData_Set001_V0.1_001810.wav	1.99298	một bình ạ
F:\archive\mp3V2\FPTOpenSpeechData_Set001_V0.1_009284.wav	2.18498	ối xin lỗi anh phải rẽ phải
F:\archive\mp3V2\FPTOpenSpeechData_Set002_V0.1_008885.wav	2.832	tôi cần tìm một nhân viên hàng không
F:\archive\mp3V2\FPTOpenSpeechData_Set001_V0.1_001289.wav	1.72898	tôi xin một tách cà phê
F:\archive\mp3V2\FPTOpenSpeechData_Set001_V0.1_009656.wav	1.68098	tôi sẽ thử loại đó trước
F:\archive\mp3V2\FPTOpenSpeechData_Set001_V0.1_004815.wav	3.36098	bạn vui lòng ký vào đây nhé
F:\archive\mp3V2\FPTOpenSpeechData_Set001_V0.1_011119.wav	1.77698	bữa sáng bắt đầu lúc bảy giờ
F:\archive\mp3V2\FPTOpenSpeechData_Set001_V0.1_004569.wav	2.25698	và những khuyết điểm nhỏ của họ
F:\archive\mp3V2\FPTOpenSpeechData_Set001_V0.1_005847.wav	3.69698	nó là sự công nhận thành quả lao động nghệ thuật của tôi
F:\archive\mp3V2\FPTOpenSpeechData_Set001_V0.1_001823.wav	1.68098	chào anh em tên hạnh
F:\archive\mp3V2\FPTOpenSpeechData_Set001_V0.1_013621.wav	1.82498	tôi phải làm điều này không
F:\archive\mp3V2\FPTOpenSpeechData_Set001_V0.1_005609.wav	2.78498	vâng tôi đang tìm một đôi giày chơi bóng rổ
F:\archive\mp3V2\FPTOpenSpeechData_Set001_V0.1_005180.wav	3.93698	chị liền kéo áo người này rồi hô hoán
F:\archive\mp3V2\FPTOpenSpeechData_Set002_V0.1_002997.wav	2.376	tuy nhiên kế hoạch này khiến tôi rất băn khoăn
F:\archive\mp3V2\FPTOpenSpeechData_Set002_V0.1_011006.wav	4.344	cơ quan quản lý sẽ giám sát nắm bắt thông tin thị trường chính xác
F:\archive\mp3V2\FPTOpenSpeechData_Set001_V0.1_001743.wav	1.82498	một ly rượu vang nhé
F:\archive\mp3V2\FPTOpenSpeechData_Set001_V0.1_009530.wav	2.11298	tôi đang làm việc toàn thời gian cho dự án
F:\archive\mp3V2\FPTOpenSpeechData_Set002_V0.1_011092.wav	3.024	cầu chúc sức khỏe cho người thân bạn bè
F:\archive\mp3V2\FPTOpenSpeechData_Set001_V0.1_001669.wav	1.77698	vui lòng mở áo đến thắt lưng
F:\archive\mp3V2\FPTOpenSpeechData_Set001_V0.1_010445.wav	2.37698	tôi muốn một cuộc kiểm tra y khoa toàn diện
F:\archive\mp3V2\FPTOpenSpeechData_Set001_V0.1_008653.wav	2.20898	anh ta có cá tính không thân thiện
F:\archive\mp3V2\FPTOpenSpeechData_Set002_V0.1_003673.wav	3.984	nếu em muốn mượn bờ vai anh anh có đồng ý không
F:\archive\mp3V2\FPTOpenSpeechData_Set001_V0.1_001525.wav	3.57698	qua đó họ có thể đưa ra các biện pháp bảo vệ rùa thông qua
F:\archive\mp3V2\FPTOpenSpeechData_Set001_V0.1_007391.wav	2.85698	chúng ta đã không gặp nhau hơn bốn năm nay rồi
F:\archive\mp3V2\FPTOpenSpeechData_Set001_V0.1_007692.wav	1.75298	chúng tôi muốn đi trượt nước
F:\archive\mp3V2\FPTOpenSpeechData_Set001_V0.1_008761.wav	1.94498	công việc ở nhà máy thoải mái
F:\archive\mp3V2\FPTOpenSpeechData_Set002_V0.1_006871.wav	4.416	tuy nhiên giá thu mua không được thông báo cụ thể
F:\archive\mp3V2\FPTOpenSpeechData_Set002_V0.1_001592.wav	3.744	hỏi về tương lai tiến chỉ vào bộ đồ nghề
F:\archive\mp3V2\FPTOpenSpeechData_Set002_V0.1_009044.wav	3.816	đích của phát triển là vì con người cho con người
F:\archive\mp3V2\FPTOpenSpeechData_Set002_V0.1_009620.wav	3.576	đi được nửa ngày chúng tôi tưởng anh bị đau chân
F:\archive\mp3V2\FPTOpenSpeechData_Set001_V0.1_013243.wav	2.68898	điều đó chắn chắn là một thất vọng lớn đối với quí vị
F:\archive\mp3V2\FPTOpenSpeechData_Set001_V0.1_013490.wav	1.82498	hình tôi gửi rửa xong chưa
F:\archive\mp3V2\FPTOpenSpeechData_Set001_V0.1_006441.wav	2.49698	cô ấy có thể gởi bảo đảm bức thư này không
F:\archive\mp3V2\FPTOpenSpeechData_Set001_V0.1_011706.wav	2.56898	biên bản cuộc họp đã được ghi lại
F:\archive\mp3V2\FPTOpenSpeechData_Set001_V0.1_003020.wav	2.35298	anh có thể làm nó lớn hơn không
F:\archive\mp3V2\FPTOpenSpeechData_Set002_V0.1_010326.wav	3.936	và ở đâu người ta cũng phải bàn tới tính khả thi
F:\archive\mp3V2\FPTOpenSpeechData_Set001_V0.1_007742.wav	2.56898	cảm ơn bây giờ tôi cảm thấy khỏe hơn rồi
F:\archive\mp3V2\FPTOpenSpeechData_Set001_V0.1_000694.wav	3.93698	khai báo điện tử nhanh chóng hơn
F:\archive\mp3V2\FPTOpenSpeechData_Set001_V0.1_008993.wav	2.16098	ở đây hút thuốc được không cô
F:\archive\mp3V2\FPTOpenSpeechData_Set002_V0.1_010505.wav	3.36	các yếu tố bên ngoài bên trong luôn thay đổi
F:\archive\mp3V2\FPTOpenSpeechData_Set001_V0.1_006889.wav	2.18498	chìa khóa phòng tôi không hoạt động
F:\archive\mp3V2\FPTOpenSpeechData_Set002_V0.1_003913.wav	4.896	các cổ phiếu khác giao dịch ở mức thấp mức tăng giảm không đáng kể
F:\archive\mp3V2\FPTOpenSpeechData_Set002_V0.1_003916.wav	4.704	bên cạnh công nghệ hằng còn rất thích đi du lịch
F:\archive\mp3V2\FPTOpenSpeechData_Set001_V0.1_005653.wav	2.35298	tôi không thể nhớ bất cứ điều gì
F:\archive\mp3V2\FPTOpenSpeechData_Set002_V0.1_004625.wav	4.968	cũng theo ông phúc lan đã bằng lòng kết hôn
F:\archive\mp3V2\FPTOpenSpeechData_Set001_V0.1_010163.wav	2.40098	nhà chung cư là sở hữu của dân
F:\archive\mp3V2\FPTOpenSpeechData_Set002_V0.1_010101.wav	3.48	sau đó mỗi cặp vợ chồng đều sinh đôi
F:\archive\mp3V2\FPTOpenSpeechData_Set001_V0.1_001224.wav	3.76898	đi lên đó là hướng bắc anh biết mà
F:\archive\mp3V2\FPTOpenSpeechData_Set001_V0.1_010911.wav	3.64898	nếu vậy tôi nên rời khỏi đây lúc nào để xem buổi diễn
F:\archive\mp3V2\FPTOpenSpeechData_Set001_V0.1_009677.wav	3.12098	bạn có thể gọi tất cả những món hàng này riêng rẽ được không
F:\archive\mp3V2\FPTOpenSpeechData_Set001_V0.1_000976.wav	1.94498	anh có thể gửi nó không
F:\archive\mp3V2\FPTOpenSpeechData_Set002_V0.1_011755.wav	2.784	tôi cũng có công việc tương lai của tôi
F:\archive\mp3V2\FPTOpenSpeechData_Set002_V0.1_009749.wav	3.744	quả thật khán giả xem phim đã không phải thất vọng
F:\archive\mp3V2\FPTOpenSpeechData_Set001_V0.1_013482.wav	1.36898	chứng khó tiểu
F:\archive\mp3V2\FPTOpenSpeechData_Set002_V0.1_009593.wav	3.144	hiện nay điều này đã được nhìn nhận đánh giá lại
F:\archive\mp3V2\FPTOpenSpeechData_Set002_V0.1_010916.wav	3.024	càng về khuya xuất hiện nhiều tốp đua xe
F:\archive\mp3V2\FPTOpenSpeechData_Set002_V0.1_010190.wav	3.264	quảng cáo là vấn đề của niềm tin chứ không phải lý trí
F:\archive\mp3V2\FPTOpenSpeechData_Set001_V0.1_013472.wav	2.37698	chúng tôi sẽ không đáp chuyến bay sáng
F:\archive\mp3V2\FPTOpenSpeechData_Set001_V0.1_001325.wav	4.08098	có danh sách vô tận các nơi hấp dẫn chẳng hạn
F:\archive\mp3V2\FPTOpenSpeechData_Set001_V0.1_013236.wav	1.89698	màn ăn mừng thi uống bia bắt đầu
F:\archive\mp3V2\FPTOpenSpeechData_Set002_V0.1_009738.wav	4.776	cái kem to khổng lồ tôi không thể ăn thêm được nữa
F:\archive\mp3V2\FPTOpenSpeechData_Set001_V0.1_009346.wav	3.79298	tôi rất tiếc ông ấy hiện đang đi nghỉ
F:\archive\mp3V2\FPTOpenSpeechData_Set001_V0.1_004374.wav	3.60098	con đường dài lắm sao anh để em đi một mình
F:\archive\mp3V2\FPTOpenSpeechData_Set001_V0.1_011456.wav	1.51298	tôi có thể xem nó ở đâu
F:\archive\mp3V2\FPTOpenSpeechData_Set001_V0.1_008021.wav	1.53698	cho phép tôi đi qua
F:\archive\mp3V2\FPTOpenSpeechData_Set001_V0.1_010781.wav	2.59298	bảy mươi tám bảy mươi chín
F:\archive\mp3V2\FPTOpenSpeechData_Set002_V0.1_003819.wav	4.224	ngay lập tức chủ nhà đã gọi điện báo cơ quan ca
F:\archive\mp3V2\FPTOpenSpeechData_Set002_V0.1_003919.wav	3.024	trên phương diện này chẳng có gì để lo lắng
F:\archive\mp3V2\FPTOpenSpeechData_Set001_V0.1_002360.wav	2.83298	tôi nghĩ anh này không thể làm công an được
F:\archive\mp3V2\FPTOpenSpeechData_Set001_V0.1_012698.wav	4.24898	động thái này của hãng nhằm thu hút thêm người dùng
F:\archive\mp3V2\FPTOpenSpeechData_Set002_V0.1_006346.wav	2.976	người mà tôi gọi là bác lại chính là bố đẻ của tôi
F:\archive\mp3V2\FPTOpenSpeechData_Set001_V0.1_013622.wav	1.68098	cái này làm từ chất liệu gì
F:\archive\mp3V2\FPTOpenSpeechData_Set002_V0.1_001398.wav	4.656	đáng tiếc rằng trước đây các em đã từng là những học sinh ngoan
F:\archive\mp3V2\FPTOpenSpeechData_Set002_V0.1_010863.wav	3.984	đây là trận đầu tiên của chúng tôi toàn đội rất quyết tâm để giành chiến thắng
F:\archive\mp3V2\FPTOpenSpeechData_Set001_V0.1_011417.wav	2.64098	chúng ta sẽ chờ cho có bàn trống hoặc đi nơi khác
F:\archive\mp3V2\FPTOpenSpeechData_Set001_V0.1_006268.wav	2.85698	giá bán đồng yên nhật của quý vị hôm nay là bao nhiêu
F:\archive\mp3V2\FPTOpenSpeechData_Set002_V0.1_008725.wav	2.616	tối qua thầy tiến đánh con nhiều lắm
F:\archive\mp3V2\FPTOpenSpeechData_Set001_V0.1_000353.wav	1.87298	tôi đến cùng bạn tôi được không
F:\archive\mp3V2\FPTOpenSpeechData_Set001_V0.1_009246.wav	3.21698	chúng ta tự trả tiền phần của mình thì sao
F:\archive\mp3V2\FPTOpenSpeechData_Set001_V0.1_002203.wav	1.10498	anh muốn nói gì
F:\archive\mp3V2\FPTOpenSpeechData_Set001_V0.1_009254.wav	2.73698	anh có thể cho tôi xem món đồ rẻ hơn không
F:\archive\mp3V2\FPTOpenSpeechData_Set002_V0.1_010363.wav	4.464	tôi e rằng tôi không thể chúng tôi sẽ quay lại
F:\archive\mp3V2\FPTOpenSpeechData_Set001_V0.1_006746.wav	2.42498	ước gì có ai đi qua cho tui tiền
F:\archive\mp3V2\FPTOpenSpeechData_Set001_V0.1_009000.wav	2.85698	hết mì gói rồi mày ăn tạm gà nướng nha
F:\archive\mp3V2\FPTOpenSpeechData_Set001_V0.1_012452.wav	3.02498	thế giới kỳ thú sầu riêng nhẹ mùi như
F:\archive\mp3V2\FPTOpenSpeechData_Set001_V0.1_000928.wav	2.25698	hãy cho tiền vào thùng vé khi anh xuống xe
F:\archive\mp3V2\FPTOpenSpeechData_Set001_V0.1_011130.wav	4.36898	hệ thống phòng ngự tài năng và giàu kinh nghiệm
